{
  "account_id" : 100 ,
  "atom_enabled" : false ,
  "automatic_planning" : true ,
  "bugs_and_chores_are_estimatable" : false ,
  "enable_incoming_emails" : true ,
  "enable_tasks" : true ,
  "initial_velocity" : 10 ,
  "iteration_length" : 1 ,
  "name" : "Executioner" ,
  "number_of_done_iterations_to_show" : 12 ,
  "point_scale" : "0,1,2,3" ,
  "public" : false ,
  "start_date" : "2014-07-22T12:00:00Z" ,
  "time_zone" : {
    "kind" : "time_zone" ,
    "olson_name" : "America/Los_Angeles" ,
    "offset" : "-07:00"
  } ,
  "velocity_averaged_over" : 3 ,
  "week_start_day" : "Monday"
}